{
  "puzzle": "test",
  "numberOfTilesPerFace": 1,
  "totalNumberOfTiles": 4,
  "faces": [
    {
      "name": "1",
      "joins": [
        {
          "fromSide": "A",
          "toSide": "B",
          "ofFace": "3"
        },
        {
          "fromSide": "B",
          "toSide": "B",
          "ofFace": "4"
        },
        {
          "fromSide": "C",
          "toSide": "B",
          "ofFace": "2"
        }
      ],
      "tilePositions": [
        {
          "position": "1",
          "joins": [
            {
              "fromSide": "A",
              "toSide": "B",
              "ofTilePosition": "1",
              "onFace": "3"
            },
            {
              "fromSide": "B",
              "toSide": "B",
              "ofTilePosition": "1",
              "onFace": "4"
            },
            {
              "fromSide": "C",
              "toSide": "B",
              "ofTilePosition": "1",
              "onFace": "2"
            }
          ]
        }
      ]
    },
    {
      "name": "2",
      "joins": [
        {
          "fromSide": "A",
          "toSide": "C",
          "ofFace": "3"
        },
        {
          "fromSide": "B",
          "toSide": "C",
          "ofFace": "1"
        },
        {
          "fromSide": "C",
          "toSide": "A",
          "ofFace": "4"
        }
      ],
      "tilePositions": [
        {
          "position": "1",
          "joins": [
            {
              "fromSide": "A",
              "toSide": "C",
              "ofTilePosition": "1",
              "onFace": "3"
            },
            {
              "fromSide": "B",
              "toSide": "C",
              "ofTilePosition": "1",
              "onFace": "1"
            },
            {
              "fromSide": "C",
              "toSide": "A",
              "ofTilePosition": "1",
              "onFace": "4"
            }
          ]
        }
      ]
    },
    {
      "name": "3",
      "joins": [
        {
          "fromSide": "A",
          "toSide": "C",
          "ofFace": "4"
        },
        {
          "fromSide": "B",
          "toSide": "A",
          "ofFace": "1"
        },
        {
          "fromSide": "C",
          "toSide": "A",
          "ofFace": "2"
        }
      ],
      "tilePositions": [
        {
          "position": "1",
          "joins": [
            {
              "fromSide": "A",
              "toSide": "C",
              "ofTilePosition": "1",
              "onFace": "4"
            },
            {
              "fromSide": "B",
              "toSide": "A",
              "ofTilePosition": "1",
              "onFace": "1"
            },
            {
              "fromSide": "C",
              "toSide": "A",
              "ofTilePosition": "1",
              "onFace": "2"
            }
          ]
        }
      ]
    },
    {
      "name": "4",
      "joins": [
        {
          "fromSide": "A",
          "toSide": "C",
          "ofFace": "2"
        },
        {
          "fromSide": "B",
          "toSide": "B",
          "ofFace": "1"
        },
        {
          "fromSide": "C",
          "toSide": "A",
          "ofFace": "3"
        }
      ],
      "tilePositions": [
        {
          "position": "1",
          "joins": [
            {
              "fromSide": "A",
              "toSide": "C",
              "ofTilePosition": "1",
              "onFace": "2"
            },
            {
              "fromSide": "B",
              "toSide": "B",
              "ofTilePosition": "1",
              "onFace": "1"
            },
            {
              "fromSide": "C",
              "toSide": "A",
              "ofTilePosition": "1",
              "onFace": "3"
            }
          ]
        }
      ]
    }
  ],
  "tiles": [
    {
      "tile": "1",
      "sideA": "1010",
      "sideB": "0010",
      "sideC": "0010"
    },
    {
      "tile": "2",
      "sideA": "0100",
      "sideB": "0100",
      "sideC": "1001"
    },
    {
      "tile": "3",
      "sideA": "0101",
      "sideB": "1001",
      "sideC": "1010"
    },
    {
      "tile": "4",
      "sideA": "0010",
      "sideB": "0100",
      "sideC": "0101"
    }
  ]
}
